{
  "rubric_id": "RUBRIC_NEGOTIATION_SAFETY",
  "name": "Negotiation safety & risk",
  "scale": {
    "min": 1,
    "max": 10
  },
  "dimensions": [
    {
      "dimension_id": "DIM_DISCLOSURE_RISK",
      "label": "Disclosure risk",
      "description": "Avoids revealing bottom line, urgency, or unnecessary concessions.",
      "anchors": [
        {
          "score": 1,
          "meaning": "Reveals bottom line/urgency; weakens position."
        },
        {
          "score": 5,
          "meaning": "Minor leaks; fixable."
        },
        {
          "score": 10,
          "meaning": "No harmful disclosures."
        }
      ]
    },
    {
      "dimension_id": "DIM_THREATS_ULTIMATUMS",
      "label": "Threats & ultimatums",
      "description": "Avoids unintended threats; uses boundaries deliberately and professionally.",
      "anchors": [
        {
          "score": 1,
          "meaning": "Escalatory threats or insults."
        },
        {
          "score": 5,
          "meaning": "Hints of ultimatum; could trigger backlash."
        },
        {
          "score": 10,
          "meaning": "Boundaries are calm and purposeful."
        }
      ]
    },
    {
      "dimension_id": "DIM_FABRICATION_RISK",
      "label": "Fabrication risk",
      "description": "Does not invent benchmarks, quotes, or claims; flags assumptions as assumptions.",
      "anchors": [
        {
          "score": 1,
          "meaning": "Contains fabricated or unverifiable claims."
        },
        {
          "score": 5,
          "meaning": "Borderline claims without support."
        },
        {
          "score": 10,
          "meaning": "All claims are supported or clearly framed as assumptions."
        }
      ]
    },
    {
      "dimension_id": "DIM_RELATIONSHIP_RISK",
      "label": "Relationship risk",
      "description": "Minimizes unnecessary relational damage given the context.",
      "anchors": [
        {
          "score": 1,
          "meaning": "Likely to damage relationship."
        },
        {
          "score": 5,
          "meaning": "Some risk; can soften."
        },
        {
          "score": 10,
          "meaning": "Relationship-safe while still effective."
        }
      ]
    }
  ]
}
